{
  "apiVersion": "compliance.example/v1alpha1",
  "kind": "ControlRealization",
  "metadata": {"id": "alder-forge.entity.awareness-training", "revision": 1},
  "spec": {
    "requirement": {"requirement": "alder-forge.awareness-training@1", "digest": "sha256:5e85372bd955b3e6f157a280d36963814fc6d1d71c2a8db388a1cc9162bbc4fe"},
    "applies_to": {"subject_types": ["entity"]},
    "adoption": {"status": "implemented", "method": "manual", "owner": "alder-forge-people-security-owner", "implementation_ref": "alder-forge-assurance/annual-awareness-training"},
    "checks": [
      {"instance_id": "alder-forge.entity.awareness-training-2602.complete", "implementation": "organization.awareness-training.complete", "evidence": {"training_report": {"max_age": "30d", "inputs": {"programme_id": "alder-forge.annual-awareness-training", "population_basis_id": "alder-forge-supplied-required-population-2026", "maximum_report_age_seconds": 2592000}}}}
    ],
    "satisfaction": {"allOf": ["alder-forge.entity.awareness-training-2602.complete"]}
  }
}
