{
  "apiVersion": "compliance.example/v1alpha1",
  "kind": "ControlRealization",
  "metadata": {"id": "alder-forge.entity.board-security-direction", "revision": 1},
  "spec": {
    "requirement": {"requirement": "alder-forge.board-security-direction@1", "digest": "sha256:64532eb617835f5876ce54ab93d384b6bf1791fedd189d3b873b6d41a5d9d38a"},
    "applies_to": {"subject_types": ["entity"]},
    "adoption": {
      "status": "implemented",
      "method": "manual",
      "owner": "alder-forge-board",
      "implementation_ref": "alder-forge-governance/board-security-direction"
    },
    "checks": [
      {
        "instance_id": "alder-forge.entity.board-security-direction.assertion",
        "implementation": "organization.assertion.required",
        "evidence": {"assertion": {"max_age": "30d", "inputs": {"scheme": "alder-forge.defstan-1101.board-security-direction"}}}
      }
    ],
    "satisfaction": {"allOf": ["alder-forge.entity.board-security-direction.assertion"]}
  }
}
