{
  "apiVersion": "compliance.example/v1alpha1",
  "kind": "ControlRealization",
  "metadata": {"id": "alder-forge.entity.authorized-software-review", "revision": 1},
  "spec": {
    "requirement": {"requirement": "alder-forge.authorized-software-review@1", "digest": "sha256:658de2f55ed8d44ac3c518df13b335917c2ae9b20cf2177faa37c2a05fdaa181"},
    "applies_to": {"subject_types": ["entity"]},
    "adoption": {"status": "implemented", "method": "manual", "owner": "alder-forge-platform-policy-owner", "implementation_ref": "alder-forge-platform/authorized-software-review"},
    "checks": [
      {"instance_id": "alder-forge.entity.authorized-software-review-2410.assertion", "implementation": "organization.assertion.required", "evidence": {"assertion": {"max_age": "30d", "inputs": {"scheme": "alder-forge.defstan-2410.authorized-software-review"}}}}
    ],
    "satisfaction": {"allOf": ["alder-forge.entity.authorized-software-review-2410.assertion"]}
  }
}
