{
  "apiVersion": "compliance.example/v1alpha1",
  "kind": "ControlRealization",
  "metadata": {
    "id": "company.linux.central-role-access",
    "revision": 1
  },
  "spec": {
    "requirement": {
      "requirement": "company.iam.role-based-access@1",
      "digest": "sha256:ba6b5a6c53d1d5b53f4d55fdac510989b8e8bd0ff354d7956160f430d0a5b4b7"
    },
    "applies_to": {
      "subject_types": [
        "linux-host"
      ],
      "match_labels": {
        "iam-profile": "company-linux"
      }
    },
    "adoption": {
      "status": "implemented",
      "method": "automated",
      "owner": "company-iam-team",
      "implementation_ref": "company-architecture/linux-central-access-v1"
    },
    "checks": [
      {
        "instance_id": "company.linux.rbac.sssd-installed",
        "implementation": "linux.access.setting-equals",
        "severity": "high",
        "remediation": "Install SSSD using the company-approved package source.",
        "parameters": {
          "section": "packages",
          "setting": "sssd_installed",
          "expected": true
        }
      },
      {
        "instance_id": "company.linux.rbac.sssd-domain-configured",
        "implementation": "linux.access.setting-equals",
        "severity": "critical",
        "remediation": "Connect SSSD to the approved company IAM domain.",
        "parameters": {
          "section": "sssd",
          "setting": "domain",
          "expected": "company.example"
        }
      },
      {
        "instance_id": "company.linux.rbac.ssh-central-group-required",
        "implementation": "linux.access.setting-equals",
        "severity": "critical",
        "remediation": "Restrict interactive SSH access to the approved company IAM group.",
        "parameters": {
          "section": "ssh",
          "setting": "allowed_groups",
          "expected": [
            "company-linux-operators"
          ]
        }
      },
      {
        "instance_id": "company.linux.rbac.unmanaged-local-login-absent",
        "implementation": "linux.access.setting-equals",
        "severity": "critical",
        "remediation": "Remove interactive authorization from unmanaged local accounts or enroll the identity in central IAM.",
        "parameters": {
          "section": "accounts",
          "setting": "unmanaged_interactive_accounts",
          "expected": []
        }
      }
    ],
    "parameter_links": [
      {
        "id": "company.linux.rbac.sssd-installed.freshness",
        "source": {
          "requirement": "company.iam.role-based-access@1",
          "digest": "sha256:ba6b5a6c53d1d5b53f4d55fdac510989b8e8bd0ff354d7956160f430d0a5b4b7",
          "slot": "privileged_evidence_max_age",
          "declaration_digest": "sha256:35ed20fc37f7aa59c704626924711a1f156e6ce70dde22c93b507fb1b4df0115",
          "schema_digest": "sha256:c4b547904c80c90e4d9ff5e335f672c55b77072a86049f1f748bd408baf49e5c"
        },
        "destination": {
          "instance_id": "company.linux.rbac.sssd-installed",
          "implementation": {
            "id": "linux.access.setting-equals",
            "version": 1,
            "fingerprint": "sha256:30a48a37139b1d60da9dae5f96f83d3d4725ea90549096ff06d71d828b58ff55"
          },
          "kind": "freshness",
          "dependency": "observation",
          "path": "/max_age"
        }
      },
      {
        "id": "company.linux.rbac.sssd-domain-configured.freshness",
        "source": {
          "requirement": "company.iam.role-based-access@1",
          "digest": "sha256:ba6b5a6c53d1d5b53f4d55fdac510989b8e8bd0ff354d7956160f430d0a5b4b7",
          "slot": "privileged_evidence_max_age",
          "declaration_digest": "sha256:35ed20fc37f7aa59c704626924711a1f156e6ce70dde22c93b507fb1b4df0115",
          "schema_digest": "sha256:c4b547904c80c90e4d9ff5e335f672c55b77072a86049f1f748bd408baf49e5c"
        },
        "destination": {
          "instance_id": "company.linux.rbac.sssd-domain-configured",
          "implementation": {
            "id": "linux.access.setting-equals",
            "version": 1,
            "fingerprint": "sha256:30a48a37139b1d60da9dae5f96f83d3d4725ea90549096ff06d71d828b58ff55"
          },
          "kind": "freshness",
          "dependency": "observation",
          "path": "/max_age"
        }
      },
      {
        "id": "company.linux.rbac.ssh-central-group-required.freshness",
        "source": {
          "requirement": "company.iam.role-based-access@1",
          "digest": "sha256:ba6b5a6c53d1d5b53f4d55fdac510989b8e8bd0ff354d7956160f430d0a5b4b7",
          "slot": "privileged_evidence_max_age",
          "declaration_digest": "sha256:35ed20fc37f7aa59c704626924711a1f156e6ce70dde22c93b507fb1b4df0115",
          "schema_digest": "sha256:c4b547904c80c90e4d9ff5e335f672c55b77072a86049f1f748bd408baf49e5c"
        },
        "destination": {
          "instance_id": "company.linux.rbac.ssh-central-group-required",
          "implementation": {
            "id": "linux.access.setting-equals",
            "version": 1,
            "fingerprint": "sha256:30a48a37139b1d60da9dae5f96f83d3d4725ea90549096ff06d71d828b58ff55"
          },
          "kind": "freshness",
          "dependency": "observation",
          "path": "/max_age"
        }
      },
      {
        "id": "company.linux.rbac.unmanaged-local-login-absent.freshness",
        "source": {
          "requirement": "company.iam.role-based-access@1",
          "digest": "sha256:ba6b5a6c53d1d5b53f4d55fdac510989b8e8bd0ff354d7956160f430d0a5b4b7",
          "slot": "privileged_evidence_max_age",
          "declaration_digest": "sha256:35ed20fc37f7aa59c704626924711a1f156e6ce70dde22c93b507fb1b4df0115",
          "schema_digest": "sha256:c4b547904c80c90e4d9ff5e335f672c55b77072a86049f1f748bd408baf49e5c"
        },
        "destination": {
          "instance_id": "company.linux.rbac.unmanaged-local-login-absent",
          "implementation": {
            "id": "linux.access.setting-equals",
            "version": 1,
            "fingerprint": "sha256:30a48a37139b1d60da9dae5f96f83d3d4725ea90549096ff06d71d828b58ff55"
          },
          "kind": "freshness",
          "dependency": "observation",
          "path": "/max_age"
        }
      }
    ]
  }
}
