{
  "apiVersion": "compliance.example/v1alpha1",
  "kind": "ControlRealization",
  "metadata": {
    "id": "company.linux.authorized-software",
    "revision": 1
  },
  "spec": {
    "requirement": {
      "requirement": "company.authorized-software@1",
      "digest": "sha256:a2dfdf98145882568603dee2ee2cfedf45f02c7bd631759ceff978e0a535888e"
    },
    "applies_to": {
      "subject_types": [
        "linux-host"
      ]
    },
    "adoption": {
      "status": "implemented",
      "method": "automated",
      "owner": "synthetic-platform-team",
      "implementation_ref": "synthetic/linux-authorized-software-v1"
    },
    "checks": [
      {
        "instance_id": "company.linux.authorized-software.only-allowed",
        "implementation": "linux.packages.only_allowed",
        "parameters": {
          "ecosystem": "linux-native"
        },
        "evidence": {
          "observation": {
            "max_age": "24h"
          }
        }
      }
    ],
    "satisfaction": {
      "allOf": [
        "company.linux.authorized-software.only-allowed"
      ]
    },
    "parameter_links": [
      {
        "id": "allowed-software",
        "source": {
          "requirement": "company.authorized-software@1",
          "digest": "sha256:a2dfdf98145882568603dee2ee2cfedf45f02c7bd631759ceff978e0a535888e",
          "slot": "allowed_software",
          "declaration_digest": "sha256:3b66bb00dc3a6e0bfd6169fda1b45f974a8674fc9c5c6ec7134b20506abf3366",
          "schema_digest": "sha256:c434c33e5389616d81fa3602dbad9b13fde68b0e06ad0f83d64c57fd3cc25590"
        },
        "destination": {
          "instance_id": "company.linux.authorized-software.only-allowed",
          "implementation": {
            "id": "linux.packages.only_allowed",
            "version": 1,
            "fingerprint": "sha256:1b6a6f296744686e247f43e11804d8c8461d3edbd0cf0ea4d8b6d678900043b1"
          },
          "kind": "parameters",
          "path": "/allowed"
        }
      }
    ]
  }
}
