{
  "apiVersion": "compliance.example/v1alpha1",
  "kind": "ControlRealization",
  "metadata": {
    "id": "alder-forge.saas.critical-access.mfa",
    "revision": 1
  },
  "spec": {
    "requirement": {
      "requirement": "alder-forge.critical-access.mfa@1",
      "digest": "sha256:2b4513c682f2bf546d27e37f9177905a7126615c86019c25c4231648eaaa3788"
    },
    "applies_to": {
      "subject_types": [
        "saas-tenant"
      ],
      "match_labels": {
        "access-scope": "critical"
      }
    },
    "adoption": {
      "status": "implemented",
      "method": "automated",
      "owner": "alder-forge-corporate-platform",
      "implementation_ref": "alder-forge-platform/critical-saas-authentication"
    },
    "checks": [
      {
        "instance_id": "alder-forge.saas.critical-access.mfa-enforced",
        "implementation": "saas.tenant.setting-equals",
        "parameters": {
          "section": "authentication",
          "setting": "mfa_enforced",
          "expected": true
        },
        "evidence": {
          "observation": {
            "max_age": "24h"
          }
        }
      }
    ]
  }
}
