{
  "apiVersion": "compliance.example/v1alpha1",
  "kind": "ControlRealization",
  "metadata": {"id": "alder-forge.entity.certification.ce-plus-scope", "revision": 1},
  "spec": {
    "requirement": {"requirement": "alder-forge.certification.ce-plus-scope@1", "digest": "sha256:3762d95ef6b942107fcd19ff2065d80ee9066e870b6f0fc20e5710a1d51d58ef"},
    "applies_to": {"subject_types": ["entity"]},
    "adoption": {"status": "implemented", "method": "manual", "owner": "alder-forge-certification-owner", "implementation_ref": "alder-forge-assurance/ce-plus-scope"},
    "checks": [
      {"instance_id": "alder-forge.entity.certification-0002.assertion", "implementation": "organization.assertion.required", "evidence": {"assertion": {"max_age": "30d", "inputs": {"scheme": "alder-forge.defstan-0002.ce-plus-scope"}}}}
    ],
    "satisfaction": {"allOf": ["alder-forge.entity.certification-0002.assertion"]}
  }
}
